{"content":{"caption":"That Boy Hi Hat — \"Shaka Zulu\". Holding #21 on the New Rap Hits playlist — the highest of the three CWI tracks on it (accepted 2026-09-14 via Audiartist; verified by full 105-track scan 2026-09-15). Alt-rap from Frederick, MD — managed by Cumulative Web Inc. https://open.spotify.com/track/3pQEzg7xFqGIk0CK1Za1Kw","day":"day-02","hashtags":["#AltRap","#ThatBoyHiHat","#ShakaZulu","#CumulativeWebInc","#PostTrapFuturism","#NewRapHits","#SupportIndieMusic"],"id":"shaka-zulu-launch","media_files":["media/shaka-zulu-official-cover.jpg","media/cwi-badge.png"],"platform_targets":["instagram","threads","x","bluesky","tiktok"],"post_order":2,"threads_text":"That Boy Hi Hat — Shaka Zulu. Holding #21 on New Rap Hits — the highest-charting of our three tracks on the playlist (accepted via Audiartist 2026-09-14; full 105-track scan verified 2026-09-15). Alt-rap, Frederick MD. https://open.spotify.com/track/3pQEzg7xFqGIk0CK1Za1Kw","type":"spotlight-post"},"pack_id":"shaka-zulu-pack","product":"THE FINAL CUT","track_ref":"Shaka Zulu","truth_gate_report":{"checked_at":"2026-09-15","checked_by":"THE FINAL CUT truth gate v1.0.0","claims_verified":[{"claim":"Shaka Zulu is #21 on the New Rap Hits playlist (verified 2026-09-15)","fact_source":"~/workspace/cwi-company/nodes/catalog.json verified_placements — positions: Shaka Zulu 21, scan_date 2026-09-15"},{"claim":"New Rap Hits acceptance date 2026-09-14 via Audiartist; 673 followers at acceptance","fact_source":"~/workspace/cwi-company/nodes/catalog.json verified_placements (accepted_date, submission_channel, playlist_followers_at_acceptance)"},{"claim":"That Boy Hi Hat is an alternative-rap artist from Frederick, MD, managed by Cumulative Web Inc (Black Lansky)","fact_source":"~/workspace/cwi-company/nodes/catalog.json artist block; owner-confirmed 2026-09-15"},{"claim":"Official Spotify URL for Shaka Zulu","fact_source":"~/workspace/cwi-company/nodes/catalog.json tracks[1].spotify_url (cross-checked with A&R catalog dossier 2026-09-15)"}],"media_attested":"Official release art (CWI-supplied) + CWI logo badge. Brand rule: the logo ships on every visual asset.","status":"pass"},"version":"1.0.0"}