{"content":{"caption":"That Boy Hi Hat — \"Zooted Zone\". 307,439 lifetime Spotify plays (observed 2026-09-14), currently holding #30 on the New Rap Hits playlist (verified 2026-09-15 by full 105-track scan). Alt-rap from Frederick, MD — managed by Cumulative Web Inc. https://open.spotify.com/track/0emH8ktA8x4DkOFLsG5xkW","day":"day-01","hashtags":["#AltRap","#ThatBoyHiHat","#ZootedZone","#CumulativeWebInc","#PostTrapFuturism","#NewRapHits","#SupportIndieMusic"],"id":"zooted-zone-launch","media_files":["media/zooted-zone-official-cover.jpg","media/cwi-badge.png"],"platform_targets":["instagram","threads","x","bluesky","tiktok"],"post_order":1,"threads_text":"That Boy Hi Hat — Zooted Zone. 307,439 lifetime Spotify plays as of the 2026-09-14 read, and it's holding #30 on New Rap Hits (full 105-track scan, verified 2026-09-15). Alt-rap from Frederick, MD. One of 24 tracks in the AI learning catalog. https://open.spotify.com/track/0emH8ktA8x4DkOFLsG5xkW","type":"spotlight-post"},"pack_id":"zooted-zone-pack","product":"THE FINAL CUT","track_ref":"Zooted Zone","truth_gate_report":{"checked_at":"2026-09-15","checked_by":"THE FINAL CUT truth gate v1.0.0","claims_verified":[{"claim":"Zooted Zone has 307,439 lifetime Spotify plays (observed 2026-09-14)","fact_source":"~/workspace/cwi-company/nodes/catalog.json metrics (observed 2026-09-14); owner memory 2026-09-14 (~307K lifetime plays)"},{"claim":"Zooted Zone is #30 on the New Rap Hits playlist (verified 2026-09-15)","fact_source":"~/workspace/cwi-company/nodes/catalog.json verified_placements — full 105-track scan, 2026-09-15"},{"claim":"That Boy Hi Hat is an alternative-rap artist from Frederick, MD, managed by Cumulative Web Inc (Black Lansky)","fact_source":"~/workspace/cwi-company/nodes/catalog.json artist block; owner-confirmed 2026-09-15"},{"claim":"Official Spotify URL for Zooted Zone","fact_source":"~/workspace/cwi-company/nodes/catalog.json tracks[0].spotify_url (spotify_url_verified: true)"}],"media_attested":"Official release art (CWI-supplied) + CWI logo badge. Brand rule: the logo ships on every visual asset.","status":"pass"},"version":"1.0.0"}